{
  "id": "via-maris",
  "title": {
    "ru": "Приморский путь",
    "historical": "Via Maris — средневековое латинское имя (от Ис 9:1 «путь приморский»); в египетских текстах — «Пути Хора»"
  },
  "kind": "international-road",
  "bibleRefs": [
    "Ис 9:1",
    "Исх 13:17"
  ],
  "waypoints": [
    {
      "label": "Египет (Цоан/дельта)"
    },
    {
      "placeId": "gaza"
    },
    {
      "label": "Афек"
    },
    {
      "placeId": "megiddo",
      "note": "ключевой перевал Кармила"
    },
    {
      "placeId": "hazor"
    },
    {
      "placeId": "damascus"
    }
  ],
  "sources": [
    {
      "ref": "Aharoni, Land of the Bible (пути)",
      "level": "B"
    },
    {
      "ref": "AWMC roads (ODbL) — база геометрии в KA-6",
      "level": "B"
    }
  ],
  "note": "Главная международная артерия Египет↔Месопотамия; Исх 13:17 — Израиль намеренно НЕ повёлся этим путём («дорогою земли Филистимской»)"
}